<?xml version="1.0" encoding="utf-8"?>
<xs:schema attributeFormDefault="unqualified" elementFormDefault="qualified" xmlns:xs="http://www.w3.org/2001/XMLSchema">
  <xs:element name="discography">
    <xs:complexType>
      <xs:sequence>
        <xs:element name="artist" type="xs:string" />
        <xs:element minOccurs="0" maxOccurs="unbounded" name="release">
          <xs:complexType>
            <xs:sequence>
              <xs:element name="name" type="xs:string" />
              <xs:element name="artist" type="xs:string" />
              <xs:element name="year" type="xs:unsignedShort" />
              <xs:element name="label" type="xs:string" />
            </xs:sequence>
            <xs:attribute name="type" type="xs:string" />
          </xs:complexType>
        </xs:element>
      </xs:sequence>
    </xs:complexType>
  </xs:element>
</xs:schema>